{
  "$schema" : "https://vibedeck-schema.alanreisanjo.workers.dev/v1/workflow.schema.json",
  "author" : "human",
  "createdAt" : "2026-10-20T00:58:19Z",
  "id" : "A4DE6D34-2F78-4983-A91E-7619DAAC696F",
  "input" : "<objetivo e critérios de aceite>",
  "maxSteps" : 10,
  "steps" : [
    {
      "id" : "planejar",
      "kind" : "skill",
      "ref" : "diagnostico-de-sistema",
      "transitions" : [
        {
          "to" : "implementar"
        }
      ]
    },
    {
      "id" : "implementar",
      "kind" : "command",
      "maxVisits" : 3,
      "note" : "Use o objetivo da execução e o plano da etapa anterior.",
      "ref" : "corrigir-sistema",
      "transitions" : [
        {
          "to" : "revisar",
          "verdict" : "IMPLEMENTADO"
        }
      ]
    },
    {
      "id" : "revisar",
      "kind" : "agent",
      "maxVisits" : 3,
      "ref" : "revisor-de-manutencao",
      "transitions" : [
        {
          "to" : "implementar",
          "verdict" : "AJUSTAR"
        }
      ]
    }
  ],
  "summary" : "Planejar → implementar → revisar, com até três rodadas de ajustes.",
  "tags" : [
    "kit"
  ],
  "title" : "Manutenção com revisão",
  "updatedAt" : "2026-10-20T00:58:19Z"
}
